{
  "format": "nova3d.scene",
  "version": 1,
  "name": "Cycle B",
  "nodes": [
    {
      "id": "b",
      "name": "B",
      "transform": {
        "position": [0, 0, 0],
        "rotationDegrees": [0, 0, 0],
        "scale": [1, 1, 1]
      },
      "components": [
        { "id": "prefab", "type": "nova3d.prefab", "properties": { "asset": "Prefabs/cycle-a.scene.json" } }
      ]
    }
  ]
}
