{
  "format": "nova3d.scene",
  "version": 1,
  "name": "Roof",
  "nodes": [
    {
      "id": "roof",
      "name": "Roof",
      "transform": {
        "position": [0, 0, 0],
        "rotationDegrees": [0, 0, 0],
        "scale": [1, 1, 1]
      },
      "components": [
        { "id": "tag", "type": "nova3d.tag", "properties": { "value": "roof" } }
      ]
    }
  ]
}
